{
  "id": "stun",
  "name": "Stun",
  "description": "A moment taken from you, and given to whoever took it.",
  "damageType": "physical",
  "tickDamage": 0,
  "tickInterval": 1,
  "maxStacks": 1,
  "duration": 1.2,
  "refreshPolicy": "reset",
  "stunDuration": 1.2,
  "iconColor": "#ffee44",
  "polarity": "debuff"
}
